----------------------------------------------------------------------------------------------------
------------------------------------ MegaLinter, by OX Security ------------------------------------
----------------------------------------------------------------------------------------------------
 - Image Creation Date: 2024-08-19T21:44:53Z
 - Image Revision: 378cc7a36ad17c7f458333ebf6803a5069fff007
 - Image Version: v8.0.0
----------------------------------------------------------------------------------------------------
The MegaLinter documentation can be found at:
 - https://megalinter.io/8.0.0
----------------------------------------------------------------------------------------------------
::group::MegaLinter initialization (expand for details)
MegaLinter will analyze workspace [/github/workspace]
GITHUB_REPOSITORY: liblaf/pre-commit-hooks
GITHUB_REF: refs/pull/76/merge
GITHUB_RUN_ID: 11310015835


[Activation] ANSIBLE_ANSIBLE_LINT has been set inactive, as none of these files has been found: ['.ansible-lint']
[Activation] EDITORCONFIG_EDITORCONFIG_CHECKER has been set inactive, as none of these files has been found: ['.editorconfig']
[Activation] JAVASCRIPT_ES has been set inactive, as none of these files has been found: ['.eslintrc.json', '.eslintrc.yml', '.eslintrc.yaml', '.eslintrc.js', '.eslintrc.cjs', 'package.json:eslintConfig']
[Activation] JSX_ESLINT has been set inactive, as none of these files has been found: ['.eslintrc.json', '.eslintrc.yml', '.eslintrc.yaml', '.eslintrc.js', '.eslintrc.cjs', 'package.json:eslintConfig']
[Activation] KUBERNETES_KUBECONFORM has been set inactive, as subdirectory has not been found: kubernetes (set value "any" to always activate)
[Activation] KUBERNETES_HELM has been set inactive, as none of these files has been found: ['Chart.yml', 'Chart.yaml']
[Activation] KUBERNETES_KUBESCAPE has been set inactive, as none of these files has been found: ['Chart.yml', 'Chart.yaml']
[Activation] REPOSITORY_LS_LINT has been set inactive, as none of these files has been found: ['.ls-lint.yml']
[SemgrepLinter] Deactivated because no ruleset has been defined
[Activation] SALESFORCE_SFDX_SCANNER_APEX has been set inactive, as subdirectory has not been found: force-app (set value "any" to always activate)
[Activation] SALESFORCE_SFDX_SCANNER_AURA has been set inactive, as subdirectory has not been found: force-app (set value "any" to always activate)
[Activation] SALESFORCE_SFDX_SCANNER_LWC has been set inactive, as subdirectory has not been found: force-app (set value "any" to always activate)
[Activation] SALESFORCE_LIGHTNING_FLOW_SCANNER has been set inactive, as subdirectory has not been found: force-app (set value "any" to always activate)
[Activation] SPELL_PROSELINT has been set inactive, as none of these files has been found: ['.proselintrc', 'proselint/config.json']
[Activation] SPELL_VALE has been set inactive, as none of these files has been found: ['.vale.ini']
[Activation] SQL_SQLFLUFF has been set inactive, as none of these files has been found: ['.sqlfluff']
[Activation] SWIFT_SWIFTLINT has been set inactive, as none of these files has been found: ['.swiftlint.yml']
[Activation] TSX_ESLINT has been set inactive, as none of these files has been found: ['.eslintrc.json', '.eslintrc.yml', '.eslintrc.yaml', '.eslintrc.js', '.eslintrc.cjs', 'package.json:eslintConfig']
[Activation] TYPESCRIPT_ES has been set inactive, as none of these files has been found: ['.eslintrc.json', '.eslintrc.yml', '.eslintrc.yaml', '.eslintrc.js', '.eslintrc.cjs', 'package.json:eslintConfig']
CLOJURE_CLJSTYLE has been disabled in MegaLinter for the following reason: Bug on cljstyle on alpine linux: https://github.com/greglook/cljstyle/issues/104
JSON_ESLINT_PLUGIN_JSONC has been disabled in MegaLinter for the following reason: Bug in eslint-plugin-jsonc : https://github.com/ota-meshi/eslint-plugin-jsonc/issues/328
MAKEFILE_CHECKMAKE has been disabled in MegaLinter for the following reason: Security issues: https://github.com/mrtazz/checkmake/issues/99
MARKDOWN_REMARK_LINT has been disabled in MegaLinter for the following reason: Bug in remark-lint: https://github.com/remarkjs/remark-lint/issues/322
SQL_TSQLLINT has been disabled in MegaLinter for the following reason: Security issues not handled: # https://github.com/tsqllint/tsqllint/issues/333
Skipped linters: ANSIBLE_ANSIBLE_LINT, BASH_EXEC, CLOJURE_CLJSTYLE, EDITORCONFIG_EDITORCONFIG_CHECKER, JAVASCRIPT_ES, JAVASCRIPT_PRETTIER, JSON_ESLINT_PLUGIN_JSONC, JSX_ESLINT, KUBERNETES_HELM, KUBERNETES_KUBECONFORM, KUBERNETES_KUBESCAPE, MAKEFILE_CHECKMAKE, MARKDOWN_REMARK_LINT, PYTHON_BANDIT, PYTHON_BLACK, PYTHON_FLAKE8, PYTHON_ISORT, PYTHON_MYPY, PYTHON_PYLINT, REPOSITORY_LS_LINT, REPOSITORY_SEMGREP, SALESFORCE_LIGHTNING_FLOW_SCANNER, SALESFORCE_SFDX_SCANNER_APEX, SALESFORCE_SFDX_SCANNER_AURA, SALESFORCE_SFDX_SCANNER_LWC, SPELL_PROSELINT, SPELL_VALE, SQL_SQLFLUFF, SQL_TSQLLINT, SWIFT_SWIFTLINT, TSX_ESLINT, TYPESCRIPT_ES, TYPESCRIPT_PRETTIER
To receive reports as email, please set variable EMAIL_REPORTER_EMAIL
::endgroup::
::group::MegaLinter now collects the files to analyse (expand for details)
Listing all files in directory [/github/workspace], then filter with:
- File extensions: , .R, .RMD, .Rmd, .bash, .bicep, .c, .c++, .cc, .cdxml, .clj, .cljc, .cljs, .coffee, .cpp, .cs, .csproj, .css, .cu, .cuh, .cxx, .dart, .dash, .edn, .env, .feature, .go, .gradle, .graphql, .groovy, .gvy, .h, .h++, .hcl, .hh, .hpp, .htm, .html, .hxx, .java, .js, .json, .json5, .jsonc, .ksh, .kt, .kts, .lua, .markdown, .md, .mdx, .nf, .p6, .php, .pl, .pl6, .pm, .pm6, .pp, .proto, .ps1, .ps1xml, .psd1, .psm1, .psrc, .pssc, .py, .r, .raku, .rakumod, .rakutest, .rb, .rs, .rst, .saas, .scala, .scss, .sh, .smk, .t, .tex, .tf, .ts, .txt, .vb, .xml, .xsd, .yaml, .yml
- File names (regex): Containerfile, Dockerfile, Jenkinsfile, Snakefile, package\.json
- Excluding .gitignored files [0]: 
Kept [29] files on [32] found files

+----MATCHING LINTERS-------------------+------------------------------------------------------------------------+----------------+------------+
| Descriptor | Linter                   | Criteria                                                               | Matching files | Format/Fix |
+------------+--------------------------+------------------------------------------------------------------------+----------------+------------+
| ACTION     | actionlint               | .yml|.yaml                                                             | 2              | no         |
| COPYPASTE  | jscpd                    |                                                                        | project        | no         |
| JSON       | jsonlint                 | .json                                                                  | 6              | no         |
| JSON       | v8r                      | .json                                                                  | 6              | no         |
| JSON       | prettier                 | .json                                                                  | 6              | yes        |
| JSON       | npm-package-json-lint    | .json|package\.json                                                    | project        | no         |
| MARKDOWN   | markdownlint             | .md                                                                    | 1              | yes        |
| MARKDOWN   | markdown-link-check      | .md                                                                    | 1              | no         |
| MARKDOWN   | markdown-table-formatter | .md                                                                    | 1              | yes        |
| REPOSITORY | checkov                  |                                                                        | project        | no         |
| REPOSITORY | devskim                  |                                                                        | project        | no         |
| REPOSITORY | dustilock                |                                                                        | project        | no         |
| REPOSITORY | git_diff                 |                                                                        | project        | no         |
| REPOSITORY | gitleaks                 |                                                                        | project        | no         |
| REPOSITORY | grype                    |                                                                        | project        | no         |
| REPOSITORY | kics                     |                                                                        | project        | no         |
| REPOSITORY | secretlint               |                                                                        | project        | no         |
| REPOSITORY | syft                     |                                                                        | project        | no         |
| REPOSITORY | trivy                    |                                                                        | project        | no         |
| REPOSITORY | trivy-sbom               |                                                                        | project        | no         |
| REPOSITORY | trufflehog               |                                                                        | project        | no         |
| RUST       | clippy                   | .rs                                                                    | project        | no         |
| SPELL      | cspell                   |                                                                        | 29             | no         |
| SPELL      | lychee                   | .md|.mdx|.markdown|.html|.htm|.rst|.txt|.json|.jsonc|.json5|.yaml|.yml | 16             | no         |
| YAML       | prettier                 | .yml|.yaml                                                             | 9              | yes        |
| YAML       | yamllint                 | .yml|.yaml                                                             | 9              | no         |
| YAML       | v8r                      | .yml|.yaml                                                             | 9              | no         |
+------------+--------------------------+------------------------------------------------------------------------+----------------+------------+
::endgroup::
Processing linters on [4] parallel cores… (can be decreased with variable PARALLEL_PROCESS_NUMBER in case of performance issues)
::group::[32m✅ Linted [JSON] files with [prettier] successfully - (0.54s)[0m (expand for details)
- Using [prettier v3.3.3] https://megalinter.io/8.0.0/descriptors/json_prettier
- MegaLinter key: [JSON_PRETTIER]
- Rules config: identified by [prettier]
- Number of files analyzed: [6]
::endgroup::
::group::[32m✅ Linted [YAML] files with [prettier] successfully - (0.61s)[0m (expand for details)
- Using [prettier v3.3.3] https://megalinter.io/8.0.0/descriptors/yaml_prettier
- MegaLinter key: [YAML_PRETTIER]
- Rules config: identified by [prettier]
- Number of files analyzed: [9]
::endgroup::
::group::[33m✅ Linted [MARKDOWN] files with [markdownlint]: Found 4 non blocking error(s) - (0.84s)[0m (expand for details)
- Using [markdownlint v0.41.0] https://megalinter.io/8.0.0/descriptors/markdown_markdownlint
- MegaLinter key: [MARKDOWN_MARKDOWNLINT]
- Rules config: [.markdownlint.json]
- Number of files analyzed: [1]
--Error detail:
CHANGELOG.md:63 MD024/no-duplicate-heading Multiple headings with the same content [Context: "###  Bug Fixes"]
CHANGELOG.md:77 MD024/no-duplicate-heading Multiple headings with the same content [Context: "###  Bug Fixes"]
CHANGELOG.md:119 MD024/no-duplicate-heading Multiple headings with the same content [Context: "###  Miscellaneous Chores"]
CHANGELOG.md:123 MD024/no-duplicate-heading Multiple headings with the same content [Context: "### 💻 Continuous Integration"]

::endgroup::
::group::[32m✅ Linted [MARKDOWN] files with [markdown-table-formatter] successfully - (0.29s)[0m (expand for details)
- Using [markdown-table-formatter v1.6.1] https://megalinter.io/8.0.0/descriptors/markdown_markdown_table_formatter
- MegaLinter key: [MARKDOWN_MARKDOWN_TABLE_FORMATTER]
- Rules config: identified by [markdown-table-formatter]
- Number of files analyzed: [1]
::endgroup::
::group::[31m❌ Linted [COPYPASTE] files with [jscpd]: Found 1 error(s) - (1.33s)[0m (expand for details)
- Using [jscpd v4.0.5] https://megalinter.io/8.0.0/descriptors/copypaste_jscpd
- MegaLinter key: [COPYPASTE_JSCPD]
- Rules config: [.jscpd.json]
--Error detail:
Clone found (rust):
 - src/schema/config.rs [45:7 - 50:2] (5 lines, 74 tokens)
   src/schema/hooks.rs [20:6 - 25:9]

┌────────┬────────────────┬─────────────┬──────────────┬──────────────┬──────────────────┬───────────────────━
│ Format │ Files analyzed │ Total lines │ Total tokens │ Clones found │ Duplicated lines │ Duplicated tokens │
├────────┼────────────────┼─────────────┼──────────────┼──────────────┼──────────────────┼───────────────────┤
│ rust   │ 9              │ 272         │ 2464         │ 1            │ 5 (1.84%)        │ 74 (3%)           │
├────────┼────────────────┼─────────────┼──────────────┼──────────────┼──────────────────┼───────────────────┤
│ Total: │ 9              │ 272         │ 2464         │ 1            │ 5 (1.84%)        │ 74 (3%)           │
└────────┴────────────────┴─────────────┴──────────────┴──────────────┴──────────────────┴───────────────────┘
Found 1 clones.
HTML report saved to /github/workspace/megalinter-reports/copy-paste/html/
ERROR: jscpd found too many duplicates (1.84%) over threshold (0%)
Error: ERROR: jscpd found too many duplicates (1.84%) over threshold (0%)
    at ThresholdReporter.report (/node-deps/node_modules/@jscpd/finder/dist/index.js:612:13)
    at /node-deps/node_modules/@jscpd/finder/dist/index.js:110:18
    at Array.forEach (<anonymous>)
    at /node-deps/node_modules/@jscpd/finder/dist/index.js:109:22
    at async /node-deps/node_modules/jscpd/dist/jscpd.js:351:5

::endgroup::
::group::[32m✅ Linted [REPOSITORY] files with [devskim] successfully - (1.16s)[0m (expand for details)
- Using [devskim v1.0.33] https://megalinter.io/8.0.0/descriptors/repository_devskim
- MegaLinter key: [REPOSITORY_DEVSKIM]
- Rules config: [/github/workspace/.github/megalinter/.devskim.json]
::endgroup::
::group::[32m✅ Linted [REPOSITORY] files with [secretlint] successfully - (0.82s)[0m (expand for details)
- Using [secretlint v8.2.4] https://megalinter.io/8.0.0/descriptors/repository_secretlint
- MegaLinter key: [REPOSITORY_SECRETLINT]
- Rules config: [.secretlintrc.json]
::endgroup::
::group::[33m✅ Linted [SPELL] files with [cspell]: Found 9 non blocking error(s) - (2.87s)[0m (expand for details)
- Using [cspell v8.14.1] https://megalinter.io/8.0.0/descriptors/spell_cspell
- MegaLinter key: [SPELL_CSPELL]
- Rules config: [/github/workspace/.cspell.json]
- Number of files analyzed: [30]
--Error detail:
 1/29 .github/auto-label.yaml 764.88ms
 2/29 .github/blunderbuss.yml 9.27ms
 3/29 .github/megalinter/.checkov.yml 6.11ms
 4/29 .github/megalinter/.devskim.json 132.10ms
 5/29 .github/release-please/.manifest.json 2.53ms
 6/29 .github/release-please/config.json 10.96ms
 7/29 .github/renovate.json 2.62ms
 8/29 .github/sync-repo-settings.yaml 2.06ms
 9/29 .github/workflows/ci.yaml 12.38ms
10/29 .github/workflows/megalinter.yaml 127.62ms X
.github/workflows/megalinter.yaml:179:15    - Unknown word (stefanzweifel) -- uses: stefanzweifel/git-auto-commit-action
	 Suggestions: []
11/29 .gitignore 1.03ms
12/29 .mega-linter.yaml 236.65ms X
.mega-linter.yaml:34:12     - Unknown word (ISORT)      -- - PYTHON_ISORT
	 Suggestions: [SORT, iost, IOST, IGOR, ISAR]
.mega-linter.yaml:35:12     - Unknown word (MYPY)       -- - PYTHON_MYPY
	 Suggestions: [MOPY, MYOPY, MACY, MANY, MAPS]
.mega-linter.yaml:36:12     - Unknown word (PYLINT)     -- - PYTHON_PYLINT
	 Suggestions: [PLYING, PINT, PAINT, PLANT, PLINK]
.mega-linter.yaml:42:12     - Unknown word (DEVSKIM)    -- REPOSITORY_DEVSKIM_CONFIG_FILE: .github
	 Suggestions: [DESK, DEVI, DKIM, DEISM, DENIM]
.mega-linter.yaml:42:53     - Unknown word (devskim)    -- .github/megalinter/.devskim.json
	 Suggestions: [desk, devi, dkim, deism, denim]
.mega-linter.yaml:43:12     - Unknown word (KICS)       -- REPOSITORY_KICS_CONFIG_FILE: .github
	 Suggestions: [KI'S, KICK, KIDS, KINS, KIPS]
.mega-linter.yaml:43:49     - Unknown word (kics)       -- .github/megalinter/kics.config
	 Suggestions: [ki's, kick, kids, kins, kips]
13/29 .pre-commit-config.yaml 5.67ms
14/29 .pre-commit-hooks.yaml 3.85ms
15/29 72b3593d-790f-46f0-87ab-66314f65c6ac-megalinter_file_names_cspell.txt 34.85ms X
72b3593d-790f-46f0-87ab-66314f65c6ac-megalinter_file_names_cspell.txt:5:20      - Unknown word (devskim)    -- github megalinter devskim
	 Suggestions: [desk, devi, dkim, deism, denim]
16/29 CHANGELOG.md 71.32ms
17/29 Makefile 5.86ms
18/29 package.json 1.51ms
19/29 src/cmd/filter.rs 13.66ms
20/29 src/cmd/mod.rs 17.99ms
21/29 src/cmd/sort/config.rs 5.91ms
22/29 src/cmd/sort/hooks.rs 3.51ms
23/29 src/cmd/sort/mod.rs 9.61ms
24/29 src/main.rs 2.06ms
25/29 src/proc/mod.rs 1.28ms
26/29 src/proc/prettier.rs 2.53ms
27/29 src/schema/config.rs 3.66ms
28/29 src/schema/hooks.rs 2.89ms
29/29 src/schema/mod.rs 1.24ms
CSpell: Files checked: 29, Issues found: 9 in 3 files.

::endgroup::
::group::[32m✅ Linted [YAML] files with [v8r] successfully - (4.54s)[0m (expand for details)
- Using [v8r v4.0.1] https://megalinter.io/8.0.0/descriptors/yaml_v8r
- MegaLinter key: [YAML_V8R]
- Rules config: identified by [v8r]
- Number of files analyzed: [9]
::endgroup::
::group::[32m✅ Linted [JSON] files with [v8r] successfully - (10.23s)[0m (expand for details)
- Using [v8r v4.0.1] https://megalinter.io/8.0.0/descriptors/json_v8r
- MegaLinter key: [JSON_V8R]
- Rules config: identified by [v8r]
- Number of files analyzed: [6]
::endgroup::
::group::[32m✅ Linted [MARKDOWN] files with [markdown-link-check] successfully - (14.28s)[0m (expand for details)
- Using [markdown-link-check v3.12.2] https://megalinter.io/8.0.0/descriptors/markdown_markdown_link_check
- MegaLinter key: [MARKDOWN_MARKDOWN_LINK_CHECK]
- Rules config: [.markdown-link-check.json]
- Number of files analyzed: [1]
::endgroup::
::group::[32m✅ Linted [REPOSITORY] files with [grype] successfully - (15.31s)[0m (expand for details)
- Using [grype v0.79.5] https://megalinter.io/8.0.0/descriptors/repository_grype
- MegaLinter key: [REPOSITORY_GRYPE]
- Rules config: [.grype.yaml]
::endgroup::
::group::[32m✅ Linted [REPOSITORY] files with [trivy] successfully - (7.92s)[0m (expand for details)
- Using [trivy v0.54.1] https://megalinter.io/8.0.0/descriptors/repository_trivy
- MegaLinter key: [REPOSITORY_TRIVY]
- Rules config: identified by [trivy]
::endgroup::
::group::[32m✅ Linted [REPOSITORY] files with [trivy-sbom] successfully - (1.23s)[0m (expand for details)
- Using [trivy-sbom v0.54.1] https://megalinter.io/8.0.0/descriptors/repository_trivy_sbom
- MegaLinter key: [REPOSITORY_TRIVY_SBOM]
- Rules config: identified by [trivy-sbom]
::endgroup::
::group::[32m✅ Linted [REPOSITORY] files with [checkov] successfully - (12.61s)[0m (expand for details)
- Using [checkov v3.2.232] https://megalinter.io/8.0.0/descriptors/repository_checkov
- MegaLinter key: [REPOSITORY_CHECKOV]
- Rules config: [/github/workspace/.github/megalinter/.checkov.yml]
::endgroup::
::group::[32m✅ Linted [ACTION] files with [actionlint] successfully - (0.04s)[0m (expand for details)
- Using [actionlint v1.7.1] https://megalinter.io/8.0.0/descriptors/action_actionlint
- MegaLinter key: [ACTION_ACTIONLINT]
- Rules config: identified by [actionlint]
- Number of files analyzed: [2]
::endgroup::
::group::[32m✅ Linted [JSON] files with [jsonlint] successfully - (0.33s)[0m (expand for details)
- Using [jsonlint v16.0.0] https://megalinter.io/8.0.0/descriptors/json_jsonlint
- MegaLinter key: [JSON_JSONLINT]
- Rules config: identified by [jsonlint]
- Number of files analyzed: [6]
::endgroup::
::group::[32m✅ Linted [SPELL] files with [lychee] successfully - (1.96s)[0m (expand for details)
- Using [lychee v0.15.1] https://megalinter.io/8.0.0/descriptors/spell_lychee
- MegaLinter key: [SPELL_LYCHEE]
- Rules config: identified by [lychee]
- Number of files analyzed: [16]
::endgroup::
::group::[32m✅ Linted [REPOSITORY] files with [dustilock] successfully - (0.01s)[0m (expand for details)
- Using [dustilock v1.2.0] https://megalinter.io/8.0.0/descriptors/repository_dustilock
- MegaLinter key: [REPOSITORY_DUSTILOCK]
- Rules config: identified by [dustilock]
::endgroup::
::group::[32m✅ Linted [JSON] files with [npm-package-json-lint] successfully - (0.54s)[0m (expand for details)
- Using [npm-package-json-lint v8.0.0] https://megalinter.io/8.0.0/descriptors/json_npm_package_json_lint
- MegaLinter key: [JSON_NPM_PACKAGE_JSON_LINT]
- Rules config: [.npmpackagejsonlintrc.json]
::endgroup::
::group::[32m✅ Linted [REPOSITORY] files with [gitleaks] successfully - (0.58s)[0m (expand for details)
- Using [gitleaks v8.18.4] https://megalinter.io/8.0.0/descriptors/repository_gitleaks
- MegaLinter key: [REPOSITORY_GITLEAKS]
- Rules config: [.gitleaks.toml]
::endgroup::
::group::[32m✅ Linted [REPOSITORY] files with [syft] successfully - (0.57s)[0m (expand for details)
- Using [syft v1.11.0] https://megalinter.io/8.0.0/descriptors/repository_syft
- MegaLinter key: [REPOSITORY_SYFT]
- Rules config: identified by [syft]
::endgroup::
::group::[32m✅ Linted [YAML] files with [yamllint] successfully - (1.82s)[0m (expand for details)
- Using [yamllint v1.35.1] https://megalinter.io/8.0.0/descriptors/yaml_yamllint
- MegaLinter key: [YAML_YAMLLINT]
- Rules config: [.yamllint.yml]
- Number of files analyzed: [9]
::endgroup::
::group::[32m✅ Linted [REPOSITORY] files with [git_diff] successfully - (0.02s)[0m (expand for details)
- Using [git_diff v2.45.2] https://megalinter.io/8.0.0/descriptors/repository_git_diff
- MegaLinter key: [REPOSITORY_GIT_DIFF]
- Rules config: identified by [git_diff]
::endgroup::
::group::[32m✅ Linted [REPOSITORY] files with [trufflehog] successfully - (4.76s)[0m (expand for details)
- Using [trufflehog v3.81.9] https://megalinter.io/8.0.0/descriptors/repository_trufflehog
- MegaLinter key: [REPOSITORY_TRUFFLEHOG]
- Rules config: identified by [trufflehog]
::endgroup::
::group::[32m✅ Linted [REPOSITORY] files with [kics] successfully - (28.79s)[0m (expand for details)
- Using [kics v2.1.2] https://megalinter.io/8.0.0/descriptors/repository_kics
- MegaLinter key: [REPOSITORY_KICS]
- Rules config: [/github/workspace/.github/megalinter/kics.config]
::endgroup::
::group::[32m✅ Linted [RUST] files with [clippy] successfully - (60.62s)[0m (expand for details)
- Using [clippy v0.1.81] https://megalinter.io/8.0.0/descriptors/rust_clippy
- MegaLinter key: [RUST_CLIPPY]
- Rules config: identified by [clippy]
[Pre][RUST_CLIPPY] run: [echo "Init RUST toolkit" && rustup default stable] in cwd [/github/workspace]
[Pre][RUST_CLIPPY] result:
Init RUST toolkit
info: syncing channel updates for 'stable-x86_64-unknown-linux-musl'
info: latest update on 2024-09-05, rust version 1.81.0 (eeb90cda1 2024-09-04)
info: downloading component 'cargo'
info: downloading component 'clippy'
info: downloading component 'rust-docs'
info: downloading component 'rust-std'
info: downloading component 'rustc'
info: downloading component 'rustfmt'
info: installing component 'cargo'
info: installing component 'clippy'
info: installing component 'rust-docs'
info: installing component 'rust-std'
info: installing component 'rustc'
info: installing component 'rustfmt'
info: default toolchain set to 'stable-x86_64-unknown-linux-musl'

  stable-x86_64-unknown-linux-musl installed - rustc 1.81.0 (eeb90cda1 2024-09-04)


::endgroup::
[Updated Sources Reporter] copied 1 fixed source files in folder /github/workspace/megalinter-reports/updated_sources.
Download it from artifacts then copy-paste it in your local repo to apply linters updates
[GitHub Comment Reporter] Posted summary as comment on liblaf/pre-commit-hooks #PR76

+----SUMMARY----+--------------------------+---------------+-------+-------+--------+--------------+
| Descriptor    | Linter                   | Mode          | Files | Fixed | Errors | Elapsed time |
+---------------+--------------------------+---------------+-------+-------+--------+--------------+
| ✅ ACTION     | actionlint               | list_of_files |     2 |       |      0 |        0.04s |
| ❌ COPYPASTE  | jscpd                    | project       |   n/a |       |      1 |        1.33s |
| ✅ JSON       | jsonlint                 | list_of_files |     6 |       |      0 |        0.33s |
| ✅ JSON       | npm-package-json-lint    | project       |   n/a |       |      0 |        0.54s |
| ✅ JSON       | prettier                 | list_of_files |     6 |     1 |      0 |        0.54s |
| ✅ JSON       | v8r                      | list_of_files |     6 |       |      0 |       10.23s |
| ⚠️ MARKDOWN   | markdownlint             | list_of_files |     1 |     0 |      4 |        0.84s |
| ✅ MARKDOWN   | markdown-link-check      | list_of_files |     1 |       |      0 |       14.28s |
| ✅ MARKDOWN   | markdown-table-formatter | list_of_files |     1 |     0 |      0 |        0.29s |
| ✅ REPOSITORY | checkov                  | project       |   n/a |       |      0 |       12.61s |
| ✅ REPOSITORY | devskim                  | project       |   n/a |       |      0 |        1.16s |
| ✅ REPOSITORY | dustilock                | project       |   n/a |       |      0 |        0.01s |
| ✅ REPOSITORY | gitleaks                 | project       |   n/a |       |      0 |        0.58s |
| ✅ REPOSITORY | git_diff                 | project       |   n/a |       |      0 |        0.02s |
| ✅ REPOSITORY | grype                    | project       |   n/a |       |      0 |       15.31s |
| ✅ REPOSITORY | kics                     | project       |   n/a |       |      0 |       28.79s |
| ✅ REPOSITORY | secretlint               | project       |   n/a |       |      0 |        0.82s |
| ✅ REPOSITORY | syft                     | project       |   n/a |       |      0 |        0.57s |
| ✅ REPOSITORY | trivy                    | project       |   n/a |       |      0 |        7.92s |
| ✅ REPOSITORY | trivy-sbom               | project       |   n/a |       |      0 |        1.23s |
| ✅ REPOSITORY | trufflehog               | project       |   n/a |       |      0 |        4.76s |
| ✅ RUST       | clippy                   | project       |   n/a |       |      0 |       60.62s |
| ⚠️ SPELL      | cspell                   | list_of_files |    30 |       |      9 |        2.87s |
| ✅ SPELL      | lychee                   | list_of_files |    16 |       |      0 |        1.96s |
| ✅ YAML       | prettier                 | list_of_files |     9 |     0 |      0 |        0.61s |
| ✅ YAML       | v8r                      | list_of_files |     9 |       |      0 |        4.54s |
| ✅ YAML       | yamllint                 | list_of_files |     9 |       |      0 |        1.82s |
+---------------+--------------------------+---------------+-------+-------+--------+--------------+

[34mYou could have same capabilities but better runtime performances if you use a MegaLinter flavor:[0m
- [cupcake] oxsecurity/megalinter/flavors/cupcake@v8 (83 linters) https://megalinter.io/8.0.0/flavors/cupcake/

[MARKDOWN_SUMMARY Reporter] Generated MARKDOWN_SUMMARY report: /github/workspace/megalinter-reports/megalinter-report.md
[31m❌ Error(s) have been found during linting[0m
To disable linters or customize their checks, you can use a .mega-linter.yml file at the root of your repository
More info at https://megalinter.io/8.0.0/configuration/
